stress-tests/performance_test/Locust_2026-04-10-15h20_locustfile.py_http___localhost_8001_requests.csv

Type,Name,Request Count,Failure Count,Median Response Time,Average Response Time,Min Response Time,Max Response Time,Average Content Size,Requests/s,Failures/s,50%,66%,75%,80%,90%,95%,98%,99%,99.9%,99.99%,100%
POST,auth_guard_login,98,93,2019.0278999943985,2081.4858704083126,2019.0278999943985,2742.864100000588,77.29591836734694,0.2308155379044021,0.21903923495009586,2000,2100,2100,2100,2100,2500,2700,2700,2700,2700,2700
GET,guard_delivered,883,0,9,12.935973386125195,4.843599992454983,177.40790000243578,14.0,2.07969510173048,0.0,9,10,10,11,23,44,59,81,180,180,180
GET,guard_pending,1295,0,64,71.84836030881546,40.7808999880217,205.3827000054298,496049.05637065636,3.0500624651653134,0.0,64,71,79,87,110,120,160,170,200,210,210
POST,parcel_add_large,221,0,8,11.745726697071039,4.650300004868768,148.78640000824817,731.868778280543,0.5205125905803353,0.0,8,9,10,10,18,42,55,62,150,150,150
POST,parcel_add_small,437,0,8,11.691494736430455,4.2052999924635515,90.7292000047164,445.8787185354691,1.0292488782063645,0.0,8,9,9,10,22,43,59,64,91,91,91
,Aggregated,2934,93,42,107.75620149957464,4.2052999924635515,2742.864100000588,219072.95739604635,6.910334573586895,0.21903923495009586,42,59,64,70,98,130,2000,2100,2700,2700,2700

documentation.md

### 6.1 Summary

- Total requests: 2934
- Total failures: 93
- Overall failure rate: 3.17%
- Aggregated average response time: 107.76 ms
- Aggregated p95: 130 ms

### 6.2 Endpoint Observations

- auth_guard_login
  - Requests: 98
  - Failures: 93
  - Primary error: 429 Too many requests
  - Average latency: 2081.49 ms
- guard_pending
  - Requests: 1295
  - Failures: 0
  - Average latency: 71.85 ms
- guard_delivered
  - Requests: 883
  - Failures: 0
  - Average latency: 12.94 ms
- parcel_add_small
  - Requests: 437
  - Failures: 0
  - Average latency: 11.69 ms
- parcel_add_large
  - Requests: 221
  - Failures: 0
  - Average latency: 11.75 ms