stress-tests/RateLimitTest/Locust_2026-04-10-15h34_locustfile.py_http___localhost_8001_requests.csv

Type,Name,Request Count,Failure Count,Median Response Time,Average Response Time,Min Response Time,Max Response Time,Average Content Size,Requests/s,Failures/s,50%,66%,75%,80%,90%,95%,98%,99%,99.9%,99.99%,100%
POST,auth_guard_login,50,0,2400.0,2879.241245999292,2319.889799997327,3384.169600001769,98.7,0.20843203445180908,0.0,2400,3400,3400,3400,3400,3400,3400,3400,3400,3400,3400
GET,guard_delivered,517,0,9,14.220686073148599,4.914299992378801,185.0272000010591,14.0,2.155187236231706,0.0,9,10,11,12,29,50,63,86,190,190,190
GET,guard_pending,750,0,70,78.28647786644676,43.42029998952057,237.54980000376236,493475.73466666666,3.126480516777136,0.0,70,78,86,95,120,130,170,180,240,240,240
POST,parcel_add_large,110,0,8,22.15574636370134,4.42480000492651,1110.1502999954391,731.8090909090909,0.45855047579398,0.0,8,9,10,10,31,48,56,59,1100,1100,1100
POST,parcel_add_small,228,0,8,11.892191666559308,4.892500001005828,72.86329999624286,445.890350877193,0.9504500771002494,0.0,8,9,10,10,18,43,55,62,73,73,73
,Aggregated,1655,0,47,130.0166569181874,4.42480000492651,3384.169600001769,223746.9099697885,6.899100340354881,0.0,47,63,71,77,100,140,2400,3400,3400,3400,3400

documentation.md

### 7.1 Summary

- Total requests: 1655
- Total failures: 0
- Overall failure rate: 0.00%
- Aggregated average response time: 130.02 ms
- Aggregated p95: 140 ms

### 7.2 Endpoint Observations

- auth_guard_login
  - Requests: 50
  - Failures: 0
  - Median latency: 2400 ms
  - Average latency: 2879.24 ms
- guard_pending
  - Requests: 750
  - Failures: 0
  - Average latency: 78.29 ms
- guard_delivered
  - Requests: 517
  - Failures: 0
  - Average latency: 14.22 ms
- parcel_add_small
  - Requests: 228
  - Failures: 0
  - Average latency: 11.89 ms
- parcel_add_large
  - Requests: 110
  - Failures: 0
  - Average latency: 22.16 ms